{
  "dataset_path": "/path/to/your/dataset",
  "base_model": "stabilityai/stable-diffusion-xl-base-1.0",
  "output_path": "/path/to/output",
  "trigger_words": ["sks", "photo"],
  "training_params": {
    "learning_rate": 1e-4,
    "batch_size": 1,
    "epochs": 10,
    "steps": 1000,
    "resolution": 512,
    "lora_rank": 16,
    "lora_alpha": 32,
    "checkpoint_steps": 500,
    "validation_steps": 100,
    "gradient_accumulation_steps": 1
  }
}
